id,key,status,current_english,best_draft_en,score,draft_index,draft_ru,draft_es,draft_pt,notes
eor_139,,missing,"Salary EUR 4,800",4. EoR vs own international entity setup: which is better?,0.143,89,4. «Официальный работодатель» или создание собственной международной компании: что лучше?,4. EoR frente a la creación de una entidad internacional propia: ¿qué es mejor?,"Se pretende começar a contratar pessoas em países onde ainda não possui estrutura empresarial, um EoR é a solução ideal. Permite expandir internacionalmente sem passar pelo processo cansativo de abrir subsidiárias e resolver todas as regras laborais locais.",Current EN may differ from SEO draft; verify before applying
eor_140,,exact,Create your first EoR contract,Create your first EoR contract,1.000,75,Составьте свой первый договор о предоставлении услуг официального работодателя,Crea tu primer contrato EoR,"Indique a pessoa responsável pelas questões financeiras. Pode ser o diretor financeiro, o responsável do departamento financeiro ou si próprio.",
eor_141,,fuzzy_review,"Add country, position, salary, start date, currency, and work visa requirements","Enter the employee's details: country of employment, position, salary, start date, salary currency, and work visa requirements.",0.741,76,"Введите данные о сотруднике: страну работы, должность, заработную плату, дату начала работы, валюту выплаты заработной платы и требования к рабочей визе.","Introduce los datos del empleado: país de trabajo, puesto, salario, fecha de inicio, moneda del salario y requisitos de visado de trabajo.",Crie o seu primeiro contrato EoR,Current EN may differ from SEO draft; verify before applying
eor_142,,weak_review,Invite,Invite an employee,0.500,77,Пригласите сотрудника,Invita a un empleado,"Introduza os dados do funcionário: país de contratação, cargo, salário, data de início, moeda salarial e requisitos de visto de trabalho.",Current EN may differ from SEO draft; verify before applying
eor_143,,missing,Employee email,Invite an employee,0.400,77,Пригласите сотрудника,Invita a un empleado,"Introduza os dados do funcionário: país de contratação, cargo, salário, data de início, moeda salarial e requisitos de visto de trabalho.",Current EN may differ from SEO draft; verify before applying
eor_144,,missing,Account,Set up your company account,0.333,71,Создайте аккаунт своей компании,Crea tu cuenta de empresa,Passos com a Garna:,Current EN may differ from SEO draft; verify before applying
eor_145,,missing,Ready to pay,Everything You Need to Hire and Pay Globally,0.364,20,"Все, что нужно для найма и оплаты труда сотрудников по всему миру",Todo lo que necesitas para contratar y pagar a nivel global,Tudo o que precisa para contratar e pagar globalmente,Current EN may differ from SEO draft; verify before applying
eor_146,,exact,Invite an employee,Invite an employee,1.000,77,Пригласите сотрудника,Invita a un empleado,"Introduza os dados do funcionário: país de contratação, cargo, salário, data de início, moeda salarial e requisitos de visto de trabalho.",
eor_147,,fuzzy_review,The employee receives an invitation by email and creates a Garna account to receive payments,"After your request in the personal account, the employee receives a personal invitation by e-mail and creates an account in Garna to receive payments.",0.778,78,После отправки запроса в личном кабинете сотрудник получает личное приглашение по электронной почте и создает аккаунт в Garna для получения выплат.,"Tras su solicitud en la cuenta personal, el empleado recibe una invitación personal por correo electrónico y crea una cuenta en Garna para recibir los pagos.",Convide um funcionário,Current EN may differ from SEO draft; verify before applying
eor_148,,missing,Wallet balance,Fund your wallet and run first payroll,0.222,79,Пополните свой кошелек и проведите первую оплату труда,Recarga tu monedero y procesa la primera nómina,"Após o pedido na conta pessoal, o funcionário recebe um convite individual por e-mail e cria uma conta na Garna para receber pagamentos.",Current EN may differ from SEO draft; verify before applying
eor_149,,missing,"$84,250",,0.000,,,,,Current EN may differ from SEO draft; verify before applying
eor_150,,missing,SWIFT SEPA Crypto Funded,You can do this in any convenient way: from SWIFT and SEPA to crypto. Start paying your salary today.,0.261,80,Вы можете сделать это любым удобным для вас способом: от SWIFT и SEPA до криптовалюты. Начните выплачивать зарплату уже сегодня.,Puedes hacerlo de la forma que te resulte más cómoda: desde SWIFT y SEPA hasta criptomonedas. Empieza a pagar tu salario hoy mismo.,Adicione fundos à carteira e execute o primeiro payroll,Current EN may differ from SEO draft; verify before applying
eor_151,,fuzzy_review,Fund your wallet and run payroll,Fund your wallet and run first payroll,0.923,79,Пополните свой кошелек и проведите первую оплату труда,Recarga tu monedero y procesa la primera nómina,"Após o pedido na conta pessoal, o funcionário recebe um convite individual por e-mail e cria uma conta na Garna para receber pagamentos.",Current EN may differ from SEO draft; verify before applying
eor_152,,weak_review,"Use SWIFT, SEPA, or crypto funding and start paying salary today",You can do this in any convenient way: from SWIFT and SEPA to crypto. Start paying your salary today.,0.533,80,Вы можете сделать это любым удобным для вас способом: от SWIFT и SEPA до криптовалюты. Начните выплачивать зарплату уже сегодня.,Puedes hacerlo de la forma que te resulte más cómoda: desde SWIFT y SEPA hasta criptomonedas. Empieza a pagar tu salario hoy mismo.,Adicione fundos à carteira e execute o primeiro payroll,Current EN may differ from SEO draft; verify before applying